{
  "$schema": "http://json-schema.org/draft-07/schema#",
  "$id": "https://qaizen/schemas/release-report.schema.json",
  "title": "Release Report",
  "description": "release/release-report.json. Produced by the Reporter Agent from context.json + test-cases + failure-analysis + bug drafts. coverage_by_risk is derived from the traceability chain (docs/traceability.md). Version 2.x is written for a 2.x failure analysis: each execution_summary block carries the per-outcome breakdown its flat counts project, and a null pass_rate when nothing ran; its numbers are derived from the execution ledger (npm run report:summary). 1.x reports keep their original meaning and are not reinterpreted.",
  "type": "object",
  "additionalProperties": false,
  "required": [
    "schema_version",
    "run_id",
    "story_id",
    "report_date",
    "summary",
    "coverage_by_risk",
    "execution_summary",
    "blocking_failures",
    "non_blocking_failures",
    "release_recommendation",
    "release_recommendation_reasoning",
    "bug_drafts",
    "evidence_paths",
    "open_questions",
    "status"
  ],
  "properties": {
    "schema_version": {
      "type": "string",
      "pattern": "^[12]\\.[0-9]+(\\.[0-9]+)?$",
      "description": "1.x: flat counts only. 2.x: counts with outcome_breakdown, derived from the execution ledger."
    },
    "run_id": {
      "type": "string",
      "minLength": 1
    },
    "story_id": {
      "type": "string",
      "pattern": "^(STORY-[0-9]+|[A-Z][A-Z0-9_]*-[0-9]+)$"
    },
    "report_date": {
      "type": "string",
      "format": "date-time",
      "description": "ISO 8601 timestamp."
    },
    "summary": {
      "type": "string",
      "description": "Short prose summary of the run.",
      "minLength": 1
    },
    "coverage_by_risk": {
      "type": "array",
      "description": "One entry per RISK-XXX from context.json.risks[]. Derived from the traceability chain.",
      "items": {
        "type": "object",
        "additionalProperties": false,
        "required": ["risk_id", "covered_by_tcs", "status"],
        "properties": {
          "risk_id": {
            "type": "string",
            "pattern": "^RISK-[0-9]+$"
          },
          "covered_by_tcs": {
            "type": "array",
            "items": {
              "type": "string",
              "pattern": "^(TC-[0-9]+|API-[0-9]+)$"
            }
          },
          "status": {
            "type": "string",
            "description": "Coverage status for this risk in this run.",
            "enum": [
              "covered_passing",
              "covered_failing",
              "covered_partial",
              "accepted_without_test",
              "uncovered"
            ]
          }
        }
      }
    },
    "execution_summary": {
      "description": "Flat {total, passed, failed, skipped, pass_rate} when only Playwright ran; grouped {e2e, api, combined} when a Newman run happened. The block shape depends on schema_version (see allOf).",
      "type": "object"
    },
    "uncovered_risks": {
      "type": "array",
      "description": "OPTIONAL. risk_ids from context.json.risks[] that have ZERO covering test cases — i.e. coverage_by_risk entries whose status is 'uncovered'. Derived deterministically from the traceability chain; no LLM. Surfaced explicitly so a reviewer sees gaps without having to scan coverage_by_risk by hand.",
      "items": {
        "type": "string",
        "pattern": "^RISK-[0-9]+$"
      }
    },
    "uncovered_high_severity_count": {
      "type": "integer",
      "minimum": 0,
      "description": "OPTIONAL (Phase 2.6). Count of uncovered_risks whose severity in context.json.risks[] is 'high'. When > 0 the release_recommendation should not be 'pass' (a high-severity risk with no test is a coverage gap)."
    },
    "summary_by_risk_level": {
      "type": "object",
      "additionalProperties": false,
      "description": "OPTIONAL. Per-severity rollup of coverage_by_risk, so a reviewer reads the release at a glance: how many high/medium/low risks are passing, failing, or uncovered. Derived deterministically from coverage_by_risk + context.json.risks[].severity; no LLM.",
      "properties": {
        "high": {
          "$ref": "#/definitions/riskLevelRollup"
        },
        "medium": {
          "$ref": "#/definitions/riskLevelRollup"
        },
        "low": {
          "$ref": "#/definitions/riskLevelRollup"
        }
      }
    },
    "untested_high_risk_items": {
      "type": "array",
      "description": "OPTIONAL. The high-severity risks with NO covering test (the named version of uncovered_high_severity_count). 'No hidden untested risks' — the report must surface these, never omit them.",
      "items": {
        "type": "object",
        "additionalProperties": false,
        "required": ["risk_id"],
        "properties": {
          "risk_id": {
            "type": "string",
            "pattern": "^RISK-[0-9]+$"
          },
          "description": {
            "type": "string"
          }
        }
      }
    },
    "flaky_tests": {
      "type": "array",
      "description": "OPTIONAL. Tests that passed on retry / showed instability, IF flakiness is tracked for this run. Empty or omitted when not tracked — never fabricated.",
      "items": {
        "type": "object",
        "additionalProperties": false,
        "required": ["test_id"],
        "properties": {
          "test_id": {
            "type": "string",
            "minLength": 1
          },
          "branch": {
            "type": "string",
            "enum": ["e2e", "api"]
          },
          "note": {
            "type": "string"
          }
        }
      }
    },
    "open_bugs_summary": {
      "type": "object",
      "additionalProperties": false,
      "description": "OPTIONAL. Rollup of bug_drafts[] for the release decision: how many open bugs, by severity, and how many have / lack a Jira key.",
      "required": ["total"],
      "properties": {
        "total": {
          "type": "integer",
          "minimum": 0
        },
        "red": {
          "type": "integer",
          "minimum": 0
        },
        "yellow": {
          "type": "integer",
          "minimum": 0
        },
        "with_jira": {
          "type": "integer",
          "minimum": 0
        },
        "without_jira": {
          "type": "integer",
          "minimum": 0
        }
      }
    },
    "conditional_pass_criteria": {
      "type": "array",
      "description": "OPTIONAL. When release_recommendation is 'conditional_pass', the explicit, checkable conditions that must hold before release — the structured form of what release_recommendation_reasoning states in prose. The rule 'conditional_pass MUST list its conditions' is satisfied by either; this field makes them machine-checkable.",
      "items": {
        "type": "string",
        "minLength": 1
      }
    },
    "external_links": {
      "type": "array",
      "description": "OPTIONAL. Links to external systems for this release: TestLink test plan, Jira issues/epics, dashboards. Tool-agnostic { system, label, url } so the project stays generic (TestLink + Jira today, others later). URLs only — never embed credentials.",
      "items": {
        "type": "object",
        "additionalProperties": false,
        "required": ["system", "url"],
        "properties": {
          "system": {
            "type": "string",
            "minLength": 1
          },
          "label": {
            "type": "string"
          },
          "url": {
            "type": "string",
            "minLength": 1
          }
        }
      }
    },
    "blocking_failures": {
      "type": "array",
      "description": "FAIL-XXX ids whose presence flips the release recommendation to fail/conditional_pass/blocked.",
      "items": {
        "type": "string",
        "pattern": "^FAIL-[0-9]+$"
      }
    },
    "non_blocking_failures": {
      "type": "array",
      "items": {
        "type": "string",
        "pattern": "^FAIL-[0-9]+$"
      }
    },
    "release_recommendation": {
      "type": "string",
      "enum": ["pass", "fail", "conditional_pass", "blocked"]
    },
    "release_recommendation_reasoning": {
      "type": "string",
      "description": "Required free-text. conditional_pass MUST list the conditions explicitly.",
      "minLength": 1
    },
    "bug_drafts": {
      "type": "array",
      "items": {
        "type": "object",
        "additionalProperties": false,
        "required": ["bug_id", "severity", "path"],
        "properties": {
          "bug_id": {
            "type": "string",
            "pattern": "^BUG-[0-9]+$"
          },
          "severity": {
            "type": "string",
            "description": "Mirrors failure.severity from analysis/failure-analysis.json. Only red failures produce bug drafts; yellow is documented here when it was promoted to a draft for human triage.",
            "enum": ["red", "yellow"]
          },
          "path": {
            "type": "string",
            "pattern": "^release/bug-drafts/BUG-[0-9]+\\.md$"
          },
          "jira_key_if_exists": {
            "type": "string",
            "description": "Populated by Phase 2 scripts/create-jira-bugs.js --apply. Empty/omitted in Phase 1.",
            "pattern": "^[A-Z][A-Z0-9_]*-[0-9]+$"
          }
        }
      }
    },
    "evidence_paths": {
      "type": "array",
      "description": "Relative paths to evidence the reviewer might want to open: HTML report, traces directory, key screenshots. Reporter must reference paths, never inline contents.",
      "items": {
        "type": "string",
        "minLength": 1
      }
    },
    "open_questions": {
      "type": "array",
      "description": "Things the human needs to answer before the report can move to status='finalized'.",
      "items": {
        "type": "string",
        "minLength": 1
      }
    },
    "status": {
      "type": "string",
      "enum": ["draft", "finalized"]
    }
  },
  "allOf": [
    {
      "if": {
        "properties": {
          "schema_version": {
            "pattern": "^2\\."
          }
        },
        "required": ["schema_version"]
      },
      "then": {
        "properties": {
          "execution_summary": {
            "oneOf": [
              {
                "$ref": "#/definitions/executionSummaryFlatV2"
              },
              {
                "$ref": "#/definitions/executionSummaryGroupedV2"
              }
            ]
          }
        }
      },
      "else": {
        "properties": {
          "execution_summary": {
            "oneOf": [
              {
                "$ref": "#/definitions/executionSummaryFlat"
              },
              {
                "$ref": "#/definitions/executionSummaryGrouped"
              }
            ]
          }
        }
      }
    }
  ],
  "definitions": {
    "riskLevelRollup": {
      "type": "object",
      "additionalProperties": false,
      "description": "Counts of risks at one severity level, by coverage status. total = covered_passing + covered_failing + covered_partial + accepted_without_test + uncovered.",
      "required": ["total"],
      "properties": {
        "total": {
          "type": "integer",
          "minimum": 0
        },
        "covered_passing": {
          "type": "integer",
          "minimum": 0
        },
        "covered_failing": {
          "type": "integer",
          "minimum": 0
        },
        "covered_partial": {
          "type": "integer",
          "minimum": 0
        },
        "accepted_without_test": {
          "type": "integer",
          "minimum": 0
        },
        "uncovered": {
          "type": "integer",
          "minimum": 0
        }
      }
    },
    "executionCounts": {
      "type": "object",
      "additionalProperties": false,
      "required": ["total", "passed", "failed", "skipped", "pass_rate"],
      "properties": {
        "total": {
          "type": "integer",
          "minimum": 0
        },
        "passed": {
          "type": "integer",
          "minimum": 0
        },
        "failed": {
          "type": "integer",
          "minimum": 0
        },
        "skipped": {
          "type": "integer",
          "minimum": 0
        },
        "pass_rate": {
          "type": "number",
          "minimum": 0,
          "maximum": 1,
          "description": "0..1 (e.g. 0.85 for 85%)."
        }
      }
    },
    "executionSummaryFlat": {
      "allOf": [
        {
          "$ref": "#/definitions/executionCounts"
        }
      ]
    },
    "executionSummaryGrouped": {
      "type": "object",
      "additionalProperties": false,
      "required": ["e2e", "api", "combined"],
      "properties": {
        "e2e": {
          "$ref": "#/definitions/executionCounts"
        },
        "api": {
          "$ref": "#/definitions/executionCounts"
        },
        "combined": {
          "$ref": "#/definitions/executionCounts"
        }
      }
    },
    "outcomeBreakdown": {
      "description": "Ledger unit outcomes behind one block of counts: passed = passed; failed = failed + blocked + flaky; skipped = skipped + not_run + expected_failure; total = all seven.",
      "type": "object",
      "additionalProperties": false,
      "required": [
        "passed",
        "failed",
        "flaky",
        "skipped",
        "blocked",
        "not_run",
        "expected_failure"
      ],
      "properties": {
        "passed": {
          "type": "integer",
          "minimum": 0
        },
        "failed": {
          "type": "integer",
          "minimum": 0
        },
        "flaky": {
          "type": "integer",
          "minimum": 0
        },
        "skipped": {
          "type": "integer",
          "minimum": 0
        },
        "blocked": {
          "type": "integer",
          "minimum": 0
        },
        "not_run": {
          "type": "integer",
          "minimum": 0
        },
        "expected_failure": {
          "type": "integer",
          "minimum": 0
        }
      }
    },
    "executionCountsV2": {
      "type": "object",
      "additionalProperties": false,
      "required": [
        "total",
        "passed",
        "failed",
        "skipped",
        "pass_rate",
        "outcome_breakdown"
      ],
      "properties": {
        "total": {
          "type": "integer",
          "minimum": 0
        },
        "passed": {
          "type": "integer",
          "minimum": 0
        },
        "failed": {
          "type": "integer",
          "minimum": 0
        },
        "skipped": {
          "type": "integer",
          "minimum": 0
        },
        "pass_rate": {
          "type": ["number", "null"],
          "minimum": 0,
          "maximum": 1,
          "description": "Strictly passed / total, 0..1. Null when total is 0: nothing ran, which is neither a pass nor a failure rate."
        },
        "outcome_breakdown": {
          "$ref": "#/definitions/outcomeBreakdown"
        }
      },
      "if": {
        "properties": {
          "total": {
            "const": 0
          }
        },
        "required": ["total"]
      },
      "then": {
        "properties": {
          "pass_rate": {
            "type": "null"
          }
        }
      },
      "else": {
        "properties": {
          "pass_rate": {
            "type": "number"
          }
        }
      }
    },
    "executionSummaryFlatV2": {
      "allOf": [
        {
          "$ref": "#/definitions/executionCountsV2"
        }
      ]
    },
    "executionSummaryGroupedV2": {
      "type": "object",
      "additionalProperties": false,
      "required": ["e2e", "api", "combined"],
      "properties": {
        "e2e": {
          "$ref": "#/definitions/executionCountsV2"
        },
        "api": {
          "$ref": "#/definitions/executionCountsV2"
        },
        "combined": {
          "$ref": "#/definitions/executionCountsV2"
        }
      }
    }
  }
}
